{
  "schema": "dmb_enriched_planning_context_packet_v1",
  "question_id": "roll-01",
  "intent_class": "planning_mutation_or_tooling",
  "corpus_preconditions": {
    "all_required_present": true,
    "checks": [
      {
        "key": "canonical_recap_s22",
        "path": "corpus/eldyrwild-markdown/Longmont Campaign/Campaign 2/Session Recaps/Session 22 - Mireward Road and Lysandro.md",
        "exists": true
      },
      {
        "key": "normalized_recap_s22",
        "path": "corpus/eldyrwild-markdown/Longmont Campaign/Campaign 2/Session Recaps/_normalized/Session 22 - Mireward Road and Lysandro.md",
        "exists": true
      },
      {
        "key": "breadcrumb_recap_s22",
        "path": "corpus/eldyrwild-markdown/Longmont Campaign/Campaign 2/Session Recaps/_breadcrumbed/Session 22 - Mireward Road and Lysandro.breadcrumbed.md",
        "exists": true
      },
      {
        "key": "session_memory_jsonl_s22",
        "path": "corpus/eldyrwild-markdown/Longmont Campaign/Campaign 2/Session Recaps/_session_memory/Session 22 - Mireward Road and Lysandro.records_meta.jsonl",
        "exists": true
      },
      {
        "key": "session_memory_meta_s22",
        "path": "corpus/eldyrwild-markdown/Longmont Campaign/Campaign 2/Session Recaps/_session_memory/Session 22 - Mireward Road and Lysandro.records_meta.json",
        "exists": true
      },
      {
        "key": "live_workspace_s23_packet",
        "path": "evals/c2_live_prep/live/session_23/live_packet.json",
        "exists": true
      },
      {
        "key": "activated_manifest",
        "path": "evals/c2_live_prep/benchmarks/c2s23_planning_corpus_manifest.json",
        "exists": true
      }
    ]
  },
  "activation_manifest_refs": [
    {
      "source_id": "prep_scaffold-s22-session-22-session-22-prep-brief-md",
      "route": "corpus/eldyrwild-markdown/Longmont Campaign/Campaign 2/Session Prep/session_22/session_22_prep_brief.md",
      "source_role": "prep_scaffold",
      "authority": "planning_scaffold",
      "admissible": true,
      "allowed_uses": [
        "planning_context",
        "reusable_prep"
      ],
      "forbidden_uses": [
        "play_facts"
      ]
    },
    {
      "source_id": "prep_scaffold-s22-session-22-session-22-travel-to-mireward-runbook-md",
      "route": "corpus/eldyrwild-markdown/Longmont Campaign/Campaign 2/Session Prep/session_22/session_22_travel_to_mireward_runbook.md",
      "source_role": "prep_scaffold",
      "authority": "planning_scaffold",
      "admissible": true,
      "allowed_uses": [
        "planning_context",
        "reusable_prep"
      ],
      "forbidden_uses": [
        "play_facts"
      ]
    }
  ],
  "retrieved_evidence": [
    {
      "path": "Longmont Campaign/Campaign 2/Session Prep/session_22/README.md",
      "source_role": "unknown",
      "authority": "unknown",
      "session_scope": [],
      "unit_id": null,
      "breadcrumb_id": null,
      "line_start": null,
      "line_end": null,
      "admissible": false,
      "allowed_uses": [],
      "forbidden_uses": [],
      "routes": [
        "Longmont Campaign/Campaign 2/Session Prep/session_22/README.md"
      ]
    },
    {
      "path": "Longmont Campaign/Campaign 2/Session Prep/session_22/session_22_prep_brief.md",
      "source_role": "prep_scaffold",
      "authority": "planning_scaffold",
      "session_scope": [
        22
      ],
      "unit_id": null,
      "breadcrumb_id": null,
      "line_start": null,
      "line_end": null,
      "admissible": true,
      "allowed_uses": [
        "planning_context",
        "reusable_prep"
      ],
      "forbidden_uses": [
        "play_facts"
      ],
      "routes": [
        "corpus/eldyrwild-markdown/Longmont Campaign/Campaign 2/Session Prep/session_22/session_22_prep_brief.md"
      ]
    },
    {
      "path": "Longmont Campaign/Campaign 2/Session Prep/session_22/session_22_travel_to_mireward_runbook.md",
      "source_role": "prep_scaffold",
      "authority": "planning_scaffold",
      "session_scope": [
        22
      ],
      "unit_id": null,
      "breadcrumb_id": null,
      "line_start": null,
      "line_end": null,
      "admissible": true,
      "allowed_uses": [
        "planning_context",
        "reusable_prep"
      ],
      "forbidden_uses": [
        "play_facts"
      ],
      "routes": [
        "corpus/eldyrwild-markdown/Longmont Campaign/Campaign 2/Session Prep/session_22/session_22_travel_to_mireward_runbook.md"
      ]
    }
  ],
  "admitted_evidence": [
    {
      "path": "Longmont Campaign/Campaign 2/Session Prep/session_22/session_22_prep_brief.md",
      "source_role": "prep_scaffold",
      "authority": "planning_scaffold",
      "session_scope": [
        22
      ],
      "unit_id": null,
      "breadcrumb_id": null,
      "line_start": null,
      "line_end": null,
      "admissible": true,
      "allowed_uses": [
        "planning_context",
        "reusable_prep"
      ],
      "forbidden_uses": [
        "play_facts"
      ],
      "routes": [
        "corpus/eldyrwild-markdown/Longmont Campaign/Campaign 2/Session Prep/session_22/session_22_prep_brief.md"
      ]
    },
    {
      "path": "Longmont Campaign/Campaign 2/Session Prep/session_22/session_22_travel_to_mireward_runbook.md",
      "source_role": "prep_scaffold",
      "authority": "planning_scaffold",
      "session_scope": [
        22
      ],
      "unit_id": null,
      "breadcrumb_id": null,
      "line_start": null,
      "line_end": null,
      "admissible": true,
      "allowed_uses": [
        "planning_context",
        "reusable_prep"
      ],
      "forbidden_uses": [
        "play_facts"
      ],
      "routes": [
        "corpus/eldyrwild-markdown/Longmont Campaign/Campaign 2/Session Prep/session_22/session_22_travel_to_mireward_runbook.md"
      ]
    }
  ],
  "rejected_evidence": [
    {
      "evidence": {
        "path": "Longmont Campaign/Campaign 2/Session Prep/session_22/README.md",
        "source_role": "unknown",
        "authority": "unknown",
        "session_scope": [],
        "unit_id": null,
        "breadcrumb_id": null,
        "line_start": null,
        "line_end": null,
        "admissible": false,
        "allowed_uses": [],
        "forbidden_uses": [],
        "routes": [
          "Longmont Campaign/Campaign 2/Session Prep/session_22/README.md"
        ]
      },
      "reason_code": "missing_manifest_entry"
    }
  ],
  "claims": [
    {
      "claim_id": "roll-01_primary_claim",
      "claim_type": "planning_tooling",
      "support_status": "partial",
      "supporting_evidence_refs": [
        "Longmont Campaign/Campaign 2/Session Prep/session_22/session_22_prep_brief.md",
        "Longmont Campaign/Campaign 2/Session Prep/session_22/session_22_travel_to_mireward_runbook.md"
      ],
      "route_refs": [
        "corpus/eldyrwild-markdown/Longmont Campaign/Campaign 2/Session Prep/session_22/session_22_prep_brief.md",
        "corpus/eldyrwild-markdown/Longmont Campaign/Campaign 2/Session Prep/session_22/session_22_travel_to_mireward_runbook.md"
      ],
      "planning_implication": "Use admitted evidence only; rejected evidence remains audit-visible.",
      "authority_notes": "Play-fact claims require canon_play/derived_memory only."
    }
  ],
  "route_context": [
    {
      "route": "corpus/eldyrwild-markdown/Longmont Campaign/Campaign 2/Session Prep/session_22/session_22_prep_brief.md",
      "source_role": "prep_scaffold",
      "authority": "planning_scaffold"
    },
    {
      "route": "corpus/eldyrwild-markdown/Longmont Campaign/Campaign 2/Session Prep/session_22/session_22_travel_to_mireward_runbook.md",
      "source_role": "prep_scaffold",
      "authority": "planning_scaffold"
    }
  ],
  "planning_implications": [
    "Packet is evidence-first; unsupported claims should remain blocked.",
    "Capability responses should default to missing/partial/unknown without evidence."
  ],
  "capability_status": {
    "status": "partial",
    "evidence": [
      "inferred_from_current_dogfood_behavior"
    ]
  },
  "blocked_or_missing": [],
  "citation_policy": {
    "play_fact_allowed_authorities": [
      "canon_play",
      "derived_memory"
    ],
    "play_fact_forbidden_authorities": [
      "pre_canonical_evidence",
      "planning_scaffold",
      "reference_tool",
      "live_observation"
    ]
  },
  "source_excerpt": "For the next leg after Session 22, the governing travel layer is the Session 22 travel stack in `Longmont Campaign/Campaign 2/Session Prep/session_22/session_22_travel_to_mireward_runbook.md`: **T-WX** (storm weather) every march day, **T-NPC** once per day, **R5** `Elderwyld/Roads/mireward_reach_road_d100_encounter_table.md` for road encounters, **T-DIL** once per day, and at camp **T-WATCH** `tr"
}