{
  "schema": "dmb_enriched_planning_context_packet_v1",
  "question_id": "auth-05",
  "intent_class": "authority_check",
  "corpus_preconditions": {
    "all_required_present": true,
    "checks": [
      {
        "key": "canonical_recap_s22",
        "path": "corpus/eldyrwild-markdown/Longmont Campaign/Campaign 2/Session Recaps/Session 22 - Mireward Road and Lysandro.md",
        "exists": true
      },
      {
        "key": "normalized_recap_s22",
        "path": "corpus/eldyrwild-markdown/Longmont Campaign/Campaign 2/Session Recaps/_normalized/Session 22 - Mireward Road and Lysandro.md",
        "exists": true
      },
      {
        "key": "breadcrumb_recap_s22",
        "path": "corpus/eldyrwild-markdown/Longmont Campaign/Campaign 2/Session Recaps/_breadcrumbed/Session 22 - Mireward Road and Lysandro.breadcrumbed.md",
        "exists": true
      },
      {
        "key": "session_memory_jsonl_s22",
        "path": "corpus/eldyrwild-markdown/Longmont Campaign/Campaign 2/Session Recaps/_session_memory/Session 22 - Mireward Road and Lysandro.records_meta.jsonl",
        "exists": true
      },
      {
        "key": "session_memory_meta_s22",
        "path": "corpus/eldyrwild-markdown/Longmont Campaign/Campaign 2/Session Recaps/_session_memory/Session 22 - Mireward Road and Lysandro.records_meta.json",
        "exists": true
      },
      {
        "key": "live_workspace_s23_packet",
        "path": "evals/c2_live_prep/live/session_23/live_packet.json",
        "exists": true
      },
      {
        "key": "activated_manifest",
        "path": "evals/c2_live_prep/benchmarks/c2s23_planning_corpus_manifest.json",
        "exists": true
      }
    ]
  },
  "activation_manifest_refs": [
    {
      "source_id": "play_recap-s22-session-recaps-session-22-mireward-road-and-lysandro-md",
      "route": "corpus/eldyrwild-markdown/Longmont Campaign/Campaign 2/Session Recaps/Session 22 - Mireward Road and Lysandro.md",
      "source_role": "play_recap",
      "authority": "canon_play",
      "admissible": true,
      "allowed_uses": [
        "play_facts",
        "open_loops",
        "planning_context",
        "continuity"
      ],
      "forbidden_uses": []
    }
  ],
  "retrieved_evidence": [
    {
      "path": "Longmont Campaign/Campaign 2/Session Recaps/Session 22 - Mireward Road and Lysandro.md",
      "source_role": "play_recap",
      "authority": "canon_play",
      "session_scope": [
        22
      ],
      "unit_id": null,
      "breadcrumb_id": null,
      "line_start": null,
      "line_end": null,
      "admissible": true,
      "allowed_uses": [
        "play_facts",
        "open_loops",
        "planning_context",
        "continuity"
      ],
      "forbidden_uses": [],
      "routes": [
        "corpus/eldyrwild-markdown/Longmont Campaign/Campaign 2/Session Recaps/Session 22 - Mireward Road and Lysandro.md"
      ]
    }
  ],
  "admitted_evidence": [
    {
      "path": "Longmont Campaign/Campaign 2/Session Recaps/Session 22 - Mireward Road and Lysandro.md",
      "source_role": "play_recap",
      "authority": "canon_play",
      "session_scope": [
        22
      ],
      "unit_id": null,
      "breadcrumb_id": null,
      "line_start": null,
      "line_end": null,
      "admissible": true,
      "allowed_uses": [
        "play_facts",
        "open_loops",
        "planning_context",
        "continuity"
      ],
      "forbidden_uses": [],
      "routes": [
        "corpus/eldyrwild-markdown/Longmont Campaign/Campaign 2/Session Recaps/Session 22 - Mireward Road and Lysandro.md"
      ]
    }
  ],
  "rejected_evidence": [],
  "claims": [
    {
      "claim_id": "auth-05_primary_claim",
      "claim_type": "authority_guardrail",
      "support_status": "supported",
      "supporting_evidence_refs": [
        "Longmont Campaign/Campaign 2/Session Recaps/Session 22 - Mireward Road and Lysandro.md"
      ],
      "route_refs": [
        "corpus/eldyrwild-markdown/Longmont Campaign/Campaign 2/Session Recaps/Session 22 - Mireward Road and Lysandro.md"
      ],
      "planning_implication": "Use admitted evidence only; rejected evidence remains audit-visible.",
      "authority_notes": "Play-fact claims require canon_play/derived_memory only."
    }
  ],
  "route_context": [
    {
      "route": "corpus/eldyrwild-markdown/Longmont Campaign/Campaign 2/Session Recaps/Session 22 - Mireward Road and Lysandro.md",
      "source_role": "play_recap",
      "authority": "canon_play"
    }
  ],
  "planning_implications": [
    "Packet is evidence-first; unsupported claims should remain blocked.",
    "Capability responses should default to missing/partial/unknown without evidence."
  ],
  "capability_status": {
    "status": "partial",
    "evidence": [
      "inferred_from_current_dogfood_behavior"
    ]
  },
  "blocked_or_missing": [],
  "citation_policy": {
    "play_fact_allowed_authorities": [
      "canon_play",
      "derived_memory"
    ],
    "play_fact_forbidden_authorities": [
      "pre_canonical_evidence",
      "planning_scaffold",
      "reference_tool",
      "live_observation"
    ]
  },
  "source_excerpt": "No. Once the canonical Session 22 recap exists at `Longmont Campaign/Campaign 2/Session Recaps/Session 22 - Mireward Road and Lysandro.md`, use that as the play-fact source of truth; raw staged table notes are only staging material unless the recap itself says otherwise. If the recap and the staged notes disagree, the recap wins."
}