{
  "schema": "dmb_enriched_planning_context_packet_v1",
  "question_id": "s22-ingest-01",
  "intent_class": "ingest_state_check",
  "corpus_preconditions": {
    "all_required_present": true,
    "checks": [
      {
        "key": "canonical_recap_s22",
        "path": "corpus/eldyrwild-markdown/Longmont Campaign/Campaign 2/Session Recaps/Session 22 - Mireward Road and Lysandro.md",
        "exists": true
      },
      {
        "key": "normalized_recap_s22",
        "path": "corpus/eldyrwild-markdown/Longmont Campaign/Campaign 2/Session Recaps/_normalized/Session 22 - Mireward Road and Lysandro.md",
        "exists": true
      },
      {
        "key": "breadcrumb_recap_s22",
        "path": "corpus/eldyrwild-markdown/Longmont Campaign/Campaign 2/Session Recaps/_breadcrumbed/Session 22 - Mireward Road and Lysandro.breadcrumbed.md",
        "exists": true
      },
      {
        "key": "session_memory_jsonl_s22",
        "path": "corpus/eldyrwild-markdown/Longmont Campaign/Campaign 2/Session Recaps/_session_memory/Session 22 - Mireward Road and Lysandro.records_meta.jsonl",
        "exists": true
      },
      {
        "key": "session_memory_meta_s22",
        "path": "corpus/eldyrwild-markdown/Longmont Campaign/Campaign 2/Session Recaps/_session_memory/Session 22 - Mireward Road and Lysandro.records_meta.json",
        "exists": true
      },
      {
        "key": "live_workspace_s23_packet",
        "path": "evals/c2_live_prep/live/session_23/live_packet.json",
        "exists": true
      },
      {
        "key": "activated_manifest",
        "path": "evals/c2_live_prep/benchmarks/c2s23_planning_corpus_manifest.json",
        "exists": true
      }
    ]
  },
  "activation_manifest_refs": [
    {
      "source_id": "table_notes-s22-ingest-staging-session-22-raw-notes-md",
      "route": "corpus/eldyrwild-markdown/Longmont Campaign/Campaign 2/_ingest_staging/session_22_raw_notes.md",
      "source_role": "table_notes",
      "authority": "pre_canonical_evidence",
      "admissible": true,
      "allowed_uses": [
        "provenance",
        "pre_recap_evidence"
      ],
      "forbidden_uses": [
        "play_facts"
      ]
    },
    {
      "source_id": "play_recap-s22-normalized-session-22-mireward-road-and-lysandro-md",
      "route": "corpus/eldyrwild-markdown/Longmont Campaign/Campaign 2/Session Recaps/_normalized/Session 22 - Mireward Road and Lysandro.md",
      "source_role": "play_recap",
      "authority": "canon_play",
      "admissible": true,
      "allowed_uses": [
        "play_facts",
        "open_loops",
        "planning_context",
        "continuity"
      ],
      "forbidden_uses": []
    }
  ],
  "retrieved_evidence": [
    {
      "path": "Longmont Campaign/Campaign 2/_ingest_staging/session_22_raw_notes.md",
      "source_role": "table_notes",
      "authority": "pre_canonical_evidence",
      "session_scope": [
        22
      ],
      "unit_id": null,
      "breadcrumb_id": null,
      "line_start": null,
      "line_end": null,
      "admissible": true,
      "allowed_uses": [
        "provenance",
        "pre_recap_evidence"
      ],
      "forbidden_uses": [
        "play_facts"
      ],
      "routes": [
        "corpus/eldyrwild-markdown/Longmont Campaign/Campaign 2/_ingest_staging/session_22_raw_notes.md"
      ]
    },
    {
      "path": "Longmont Campaign/Campaign 2/Session Recaps/_normalized/Session 22 - Mireward Road and Lysandro.md",
      "source_role": "play_recap",
      "authority": "canon_play",
      "session_scope": [
        22
      ],
      "unit_id": null,
      "breadcrumb_id": null,
      "line_start": null,
      "line_end": null,
      "admissible": true,
      "allowed_uses": [
        "play_facts",
        "open_loops",
        "planning_context",
        "continuity"
      ],
      "forbidden_uses": [],
      "routes": [
        "corpus/eldyrwild-markdown/Longmont Campaign/Campaign 2/Session Recaps/_normalized/Session 22 - Mireward Road and Lysandro.md"
      ]
    }
  ],
  "admitted_evidence": [
    {
      "path": "Longmont Campaign/Campaign 2/Session Recaps/_normalized/Session 22 - Mireward Road and Lysandro.md",
      "source_role": "play_recap",
      "authority": "canon_play",
      "session_scope": [
        22
      ],
      "unit_id": null,
      "breadcrumb_id": null,
      "line_start": null,
      "line_end": null,
      "admissible": true,
      "allowed_uses": [
        "play_facts",
        "open_loops",
        "planning_context",
        "continuity"
      ],
      "forbidden_uses": [],
      "routes": [
        "corpus/eldyrwild-markdown/Longmont Campaign/Campaign 2/Session Recaps/_normalized/Session 22 - Mireward Road and Lysandro.md"
      ]
    }
  ],
  "rejected_evidence": [
    {
      "evidence": {
        "path": "Longmont Campaign/Campaign 2/_ingest_staging/session_22_raw_notes.md",
        "source_role": "table_notes",
        "authority": "pre_canonical_evidence",
        "session_scope": [
          22
        ],
        "unit_id": null,
        "breadcrumb_id": null,
        "line_start": null,
        "line_end": null,
        "admissible": true,
        "allowed_uses": [
          "provenance",
          "pre_recap_evidence"
        ],
        "forbidden_uses": [
          "play_facts"
        ],
        "routes": [
          "corpus/eldyrwild-markdown/Longmont Campaign/Campaign 2/_ingest_staging/session_22_raw_notes.md"
        ]
      },
      "reason_code": "authority_forbidden_for_play_fact"
    }
  ],
  "claims": [
    {
      "claim_id": "s22-ingest-01_primary_claim",
      "claim_type": "play_fact",
      "support_status": "partial",
      "supporting_evidence_refs": [
        "Longmont Campaign/Campaign 2/Session Recaps/_normalized/Session 22 - Mireward Road and Lysandro.md"
      ],
      "route_refs": [
        "corpus/eldyrwild-markdown/Longmont Campaign/Campaign 2/Session Recaps/_normalized/Session 22 - Mireward Road and Lysandro.md"
      ],
      "planning_implication": "Use admitted evidence only; rejected evidence remains audit-visible.",
      "authority_notes": "Play-fact claims require canon_play/derived_memory only."
    }
  ],
  "route_context": [
    {
      "route": "corpus/eldyrwild-markdown/Longmont Campaign/Campaign 2/Session Recaps/_normalized/Session 22 - Mireward Road and Lysandro.md",
      "source_role": "play_recap",
      "authority": "canon_play"
    }
  ],
  "planning_implications": [
    "Packet is evidence-first; unsupported claims should remain blocked.",
    "Capability responses should default to missing/partial/unknown without evidence."
  ],
  "capability_status": {
    "status": "partial",
    "evidence": [
      "inferred_from_current_dogfood_behavior"
    ]
  },
  "blocked_or_missing": [],
  "citation_policy": {
    "play_fact_allowed_authorities": [
      "canon_play",
      "derived_memory"
    ],
    "play_fact_forbidden_authorities": [
      "pre_canonical_evidence",
      "planning_scaffold",
      "reference_tool",
      "live_observation"
    ]
  },
  "source_excerpt": "Three carry-forward outcomes from Session 22 for Session 23 prep:\n\n1. **The party is now committed to the swamp/source-of-cult mission.** Grobnok relayed that Mirathorn can’t spare the group’s attention right now, that the city’s corrupted-meat outbreak is back, and that the council wants them to continue to where the problem originates. This is the main directive coming out of `Longmont Campaign/"
}